id,title,text,url,rse,source_lang,created_at,published_at,rssfeed_id,source,reference_id,publication_date,lang
U645GOM4IX,Sad summer for West Nile virus in Europe and North America (but good for us),"Where the hell are all the people? by Philip Copitch
The raging COVID-19 pandemic in North America and Europe in March and April 2020 caused people to shelter-in-place, protecting them from mosquito bites. Later, as lockdowns were gradually lifted, and people started getting outside, mosquitoes had plenty of chance to bite people. However, as the entire public health infrastructure was diverted to respond to the COVID-19 response, there was a concern that lack of attention could lead to potential outbreaks of other diseases. In particular, mosquito- and tick-borne diseasesВ  generally receive less attention than directly transmitted pathogens, given that most of these pathogens are not as common. This is a valid concern, already demonstrated in other parts of the world such as a resurgence of dengue and malaria with reduced control and investments.
In North America and Europe, the most important endemic mosquito-borne disease is West Nile virus. West Nile virus was first detected outside of Africa in Europe in the 1960s, and spread more widely in the 1990s and 2000s. It was also introduced into North America through New York in 1999, and quickly spread across the continent, reaching the Pacific coast by 2003. West Nile virus became endemic on both continents, perpetuated locally in a bird-mosquito amplification cycle, spilling over and infecting dead-end hosts such as horses, people, and other mammals. Between 1999 and 2014, 37,000 cases were reported in the United States, 1600 of those involving neurological symptoms, such as meningitis, encephalitis or flaccid paralysis, and causing an estimated economic burden of $778 million in healthcare costs and lost productivity.
There has been large variability in the annual number of reported cases between years both in North America and Europe, partly explained by variation in climate-driven temperature anomalies, viral genetics, as well as ecological factors such as avian host immunity. While there was a hope that case numbers will gradually decline past 2003 in the United States, there was a large outbreak in 2012, when 5,674 cases were reported, 2,873 of which were neuroinvasive, and 286 of those patients died. Similarly, 2018 in Europe proved to be a record year for West Nile virus infections, with 2083 cases and 181 deaths reported, across a large geographic extent of Europe, mainly attributed to ideal climatic conditions such as high temperatures.
Given this large variability in West Nile virus infection rates, and the fact that it has been 8 years since the largest outbreak in North America, it was worrisome this summer that we would get another large West Nile virus outbreak. That would have very difficult, as public health resources have been diverted away from environmental health to COVID-19 response, creating a situation where, potentially, human cases would become the sentinels for WNV transmission between mosquitoes, not the other way around. This was such a concern that a group of mosquito experts at the CDC published a call in the Morbidity and Mortality Weekly Report for the continuation of mosquito and WNV surveillance amid the pandemic. For example, in Spokane County, where I live, staff members at the Spokane Regional Health District who normally deal with Environmental Health have been tasked with COVID-19 response. In addition, the Washington Department of Health has stopped receiving mosquitoes from surveillance partners, such as myself, to identify and test those mosquitoes for West Nile virus. I actually collected mosquitoes using CDC-light and gravid traps in Spokane County, and am still in the process of learning the molecular methods to test them myself for WNV in my lab. That basically left Spokane County without functional West Nile virus surveillance of mosquitoes this summer, so I wouldnвЂ™t have noticed a large increase in risk to people. Fortunately, the Mosquito Control Districts in our state still kept collecting and testing mosquitoes, and providing data to the State and the CDC.
Human disease cases, reported to CDC ArboNet by county of residence Map made by CDC ArboNet https://wwwn.cdc.gov/arbonet/Maps/ADB_Diseases_Map/index.html
At this point, it seems like that we got lucky, and there hasnвЂ™t been a large outbreak of WNV, neither in North America, nor in Europe. As of October 6, 2020, only 279 cases of West Nile virus disease have been reported in the United States, of which 212 were neuroinvasive; however, cases were spread across the US. There were generally low numbers of WNV detections in horses and mosquitoes as well, although the latter could have been a side effect of limited surveillance.
Comparison of areas reporting human cases in 2020 with previous transmission seasons by ECDC (https://www.ecdc.europa.eu/sites/default/files/images/ECDC_WNF_Affected_current_and_past_seasons_02-10.png)
In Europe, as of October 1, 2020, EU Member States reported 257 cases and 30 deaths, most of them in Greece, Italy and Spain, almost 10 times less cases and deaths than in 2018. In addition, the geographic area where WNV cases were reported were also much smaller than in 2018, except for a few areas in Germany and Spain, from where WNV cases have not yet been reported before.
Why did we get so lucky? IвЂ™m quite sure. However, one of the factors cited as the massive WNV outbreak in the United States was a prolonged drought. Comparing the drought maps of 2012 and 2020 for the United States, one can see that there was a much more severe and widespread drought in 2012 compared to 2020.В  В So we might have been saved byВ  less heat and more rain!
Of course, the mosquito and West Nile virus season in North America and Europe is not quite over, and there might be additional human cases still reported in the next few weeks. However, itвЂ™s unlikely that this overall trend will change.
We should take our luck with mosquitoes and West Nile virus this summer in our stride, and make sure we build back our mosquito and West Nile virus surveillance capacity that we lost this summer. I will certainly work hard on getting my lab ready to test the mosquitoes I collect in Spokane County next year, and I also hope that the Washington Department of Health will reestablish their capacity to identify and test mosquitoes for West Nile. Ultimately, I do hope that the COVID-19 pandemic will lead our society to appreciate more the importance of disease surveillance and be willing to invest more money in maintaining it.",http://blogs.biomedcentral.com/bugbitten/2020/10/09/sad-summer-for-west-nile-virus-in-europe-and-north-america-but-good-for-us/,"North America, North America, North America, North America, North America, North America, North America, North America",,09/10/2020 10:30,2020-10-09 04:00:58+00:00,de27fa2ff4a5,blogs.biomedcentral.com,,1602223258,EN
3VVYXSRFNU,Cat Que Virus incapable of triggering epidemic: ICMR-NIV Director,"Cat Que Virus incapable of triggering epidemic: ICMR-NIV Director 
Ashish Srivastava 
New Delhi, Oct 5 ( IANS ): The Indian Council of Medical Research ( ICMR ) published a study a few days ago wherein the world got to know about a virus which was reported in China and Vietnam in the past, and was found in India as well. 
However, the media sensationalised it as another virus from China that could unleash an epidemic, fanning fear among the people who are trying to come to terms with the coronavirus pandemic. 
The scientists of ICMR-National Institute of Virology ( NIV ), Pune, came on record and told IANS that the Cat Que Virus ( CQV ) can not trigger an epidemic. 
The most it could do is cause `` sporadic infections in rural areas ''. They also concluded that CQV could not be perceived as a major public health threat at the present moment. 
`` Our conclusion is that it can cause sporadic infections in rural areas where culicine vectors ( a breed of mosquitoes ) are found to breed. This virus does n't have the capabilities to cause an epidemic or pandemic, '' said DT Mourya, Director of Virology, NIV. 
The CQV is not new to India. Mourya told IANS that scientists had first isolated CQV long back in 1961 in Sagar district in Karnataka. 
`` It belongs to ` Bunyaviridae ', which is one of the largest families of animal viruses. It houses 350 viruses, most of which are arthropod-borne. In the past, many viruses from this family have been isolated and reported from India such as Kaisodi virus, Umbre virus, Oya virus, Chittoor virus, Thottapalayam virus, Kaikalur virus, Thimiri virus, Sathuperi virus, Ganjam virus etc.. Many closely related viruses from this group have been isolated from mosquitos, humans, birds and pigs across a vast geographic region, '' Mourya said. 
Cases of CQV were first reported in 2004 when it was isolated from mosquitoes during surveillance in Vietnam and later in Uganda, scientists informed. 
The study published by ICMR detected CQV antibodies in two out of 883 human serum samples tested against the virus. These samples were collected from various Indian states during 2014 - 2017. 
Both the samples tested returned positive for anti-CQV IgG antibody, indicating that they were infected with the virus at some point. The study showed that Indian mosquito breeds such as Ae. aegypti, Cx. quinquefasciatus and Cx. Tritaeniorhynchus were susceptible to the virus. Besides, pigs and birds like Jungle Myna may also act as a host to the virus. 
The study also showed that the virus could be transmitted when a person is bitten by a mosquito. This virus is known to cause encephalitis-like symptoms similar to Japanese encephalitis ( JE ). 
`` Cat Que virus is a rare infection and is known to be transmitted by certain culicine mosquito species that are also known to transmit JE virus. The natural cycle of this virus looks similar to JE virus. These viruses can cause acute, self-limiting febrile illness that generally gets clubbed into a viral fever and can be misdiagnosed due to similarity to many existing infections like dengue, chikungunya, malaria etc., '' Mourya explained. 
Considering these isolations from the neighbouring countries -- CQV in Culex mosquitoes in China and pigs of Vietnam -- and assuming the spread of vector mosquitoes in India, ICMR-NIV attempted to develop diagnostic assays for rapid detection of this virus. 
Pragya D Yadav, a scientist at NIV and one of the researchers of the study, said that the research conducted is a part of exploratory studies of the institute and people should perceive it as a major health threat. 
`` The entire work is part of the exploratory research studies conducted by NIV as part of its research activity for developing proactive preparedness for new viruses. At the present moment, the Cat Que virus is not at all perceived as a major public health threat and does not merit enhanced attention, '' said Yadav. 
`` Active infection by CQV has been detected in India. The antibodies have been found in only two persons in the last seven years, and even those two people never developed any symptoms of the disease. It is very less likely that the infection by this particular virus can spread in humans. We need to screen more samples to understand its prevalence. 
`` However, all should take precautions and follow safety measures which include prevention of water collection in plants, water coolers and nearby surroundings, '' said Guduru Narayana Prudhvi Raj, Senior Consultant and General Physician at Apollo Tele. 
Health.",http://www.daijiworld.com/news/newsDisplay.aspx?newsID=757990,#,,05/10/2020 13:13,2020-10-05 10:31:52+00:00,de27fa2ff4a5,www.daijiworld.com,,1601901112,EN
10O9CWIMFY,West Nile Virus infections found in Tulare County,"West Nile Virus infections found in Tulare County. Here's what you can do to be safe. 
James Ward 

| Visalia Times-Delta 
Mosquitoes are the absolute worst. Here's how to stop them. The summertime pest can spread diseases, like West Nile Virus, encephalitis and Zika. Fortunately, we can keep their numbers down if we work together. Two Tulare County people have confirmed cases of West Nile Virus and three more county residents are suspected of contracting the mosquito-borne disease, the Tulare County Health and Human Services Agency reported on Thursday. Tulare County Public Health Officer Dr. Karen Haught is urging residents to take precautions against mosquito bites, as mosquito samples positive for West Nile Virus have been found in multiple locations within Tulare County. In addition, samples indicate that St. Louis Encephalitis Virus ( SLEV ) may also be present, posing a risk to the public, Haught said. The West Nile Virus is transmitted to humans by mosquitoes, and there is no vaccine or medication to treat the virus, according to the Centers for Disease Control and Prevention. Most people infected with West Nile will have no symptoms; however, about 1 in 5 people will develop a fever with other symptoms from two to 14 days after being infected, the CDC reports. Severe cases of West Nile Virus can affect the central nervous system, resulting in meningitis and/or encephalitis, and can result in death or long-term disability, the CDC reports. The St. Louis Encephalitis Virus ( SLEV ) is in the same virus family as West Nile Virus. Both viruses are transmitted to humans when bitten by an infected mosquito, the CDC reports. Most people infected with SLEV will have few to no symptoms. The most common symptoms are mild, flu-like symptoms, including fever and headache, from five to 15 days after being infected, the CDC reports. Severe cases of SLEV can also affect the central nervous system, resulting in meningitis and/or encephalitis, and can result in death or long-term disability, the CDC reports. Prevention Lookout for homes that are unoccupied or in foreclosure, since many have swimming pools or backyard ponds that are breeding grounds for mosquitoes, Tulare County health officials advise. Contact your local mosquito abatement district if you see areas of standing water that may be a breeding area for mosquitoes. Tulare County has three mosquito abatement districts providing abatement services to residents: Delta Vector Control ( Mosquito Abatement District ) -- Covering the northern portion of Tulare County. Contact the Visalia Office at (559)В 732-8606 or visit online at http://www.deltavcd.com/.Tulare Mosquito Abatement District -- Covering the western portion of Tulare County. Contact the Tulare Office at (559)В 686-6628 or visit online at https://www.tularemosquito.com/.Delano Mosquito Abatement District -- Covering the southern portion of Tulare County. Contact the Delano Office at (661)В 725-3114 or visit online at https://delanomosquito.com/.Animals and West Nile Horses are also particularly susceptible to infection with West Nile Virus, but there is a vaccine for horses to prevent these diseases, and horse owners should have their horses vaccinated annually and keep vaccinations up to date as a preventive measure. Information: http://westnile.ca.gov/.Mosquito bite protection To avoid being bitten by mosquitos and reducing your risk of West Nile Virus and SLEV exposure, Tulare County health officials advise: Use EPA-registered insect repellent such as DEET. Always follow label instructions carefully. Dress in long sleeves and pants during dawn and dusk or in areas where mosquitoes are active. Drain standing water that may produce mosquitoes. Repair or replace door and window screens that have tears or holes. James Ward covers entertainment, news, sports and lifestyles for the Visalia Times-Delta/Tulare Advance-Register. Follow him on Twitter. Get alerts and keep up on all things Tulare County for as little as $ 1 a month. Subscribe today.",https://www.visaliatimesdelta.com/story/news/2020/10/01/west-nile-virus-infections-found-tulare-county/5883401002/,#,,02/10/2020 03:43,2020-10-01 17:08:05+00:00,de27fa2ff4a5,www.visaliatimesdelta.com,,1601579285,EN
K62QTW2MF3,What is Cat Que virus?,"What is Cat Que virus? 
By: Explained Desk | New Delhi | 

Updated: October 1, 2020 7:58:20 am 

The presence of the Cat Que virus has been largely reported in Culex mosquitoes in China. In a study published in July in the Indian Journal of Medical Research, scientists from the Pune-based Maximum Containment Laboratory and ICMR-National Institute of Virology have noted the presence of antibodies against the Cat Que virus ( CQV ) in two human serum samples. 
What does the study say? 
The presence of the Cat Que virus has been largely reported in Culex mosquitoes in China and in pigs in Vietnam. For the study, 1020 human serum samples that showed acute febrile illness during 2014 - 2017 were collected. All these samples, however, were found to be negative for CQV when subjected to the real-time RT-PCR test. Of these samples, the majority ( 806 ) were collected from Karnataka, followed by Maharashtra ( 116 ), Kerala ( 51 ), Madhya Pradesh ( 20 ) and Gujarat ( 27 ). 
However, antibody positivity was recorded in two of the 883 samples that were tested for the presence of antibodies. These two samples were taken from Karnataka in 2014 and 2017. Significantly, the study notes that a virus was isolated from a jungle myna serum sample in Sagar district of Karanataka in 1961. This virus was characterised as CQV in 2016 using next-generation sequencing technology. 
Why was this study undertaken? 
The study, which was conducted in 2017 - 2018, was undertaken to develop diagnostic tests for CQV prompted by the spread of similar species of Culex mosquitoes in India. 
Express Explained is now on Telegram. Click here to join our channel ( @ieexplained ) and stay updated with the latest 
What is the Cat Que virus? 
For CQV, domestic pigs are considered to be the primary mammalian hosts. Antibodies against the virus have been reported in swine reared locally in China, which indicates that the virus has formed a `` natural cycle '' in the local area and has the ability to spread in pigs and other animal populations through mosquitoes. 
A paper published in the journal Vector Borne and Zoonotic Diseases in 2015 says that CQV belongs to the Simbu serogroup and infects both humans and economically important livestock species. It was first isolated in 2004 from mosquitoes during the surveillance of arbovirus activity in northern Vietnam. In this study, researchers reported a CQV strain ( SC0806 ), which was isolated from mosquito samples collected in China in 2006 and 2008. 
How can humans get infected and is there a cause for concern? 
Humans can get infected through mosquitoes as well. In the study, scientists note that because of positivity in human serum samples and the replication capability of CQV in mosquitoes, there is only a `` possible disease-causing potential '' of CQV in the Indian scenario. Further, `` Availability of vector, primary mammalian host ( swine ) and confirmation of CQV from jungle myna signifies the potential of this Orthobunyavirus as a public health pathogen in India, '' the study says '' ( CQV belongs to the genus Orthobunyavirus ). 
So, is this virus dangerous? 
It is not clear. Other viruses that belong to the same genus as CQV and are similarly transmitted through mosquitoes include the Cache valley virus that can cause meningitis, the La Crosse virus that can cause paediatric encephalitis, the Jamestown Canyon virus that causes Jamestown Canyon encephalitis and the Guaroa virus that causes febrile illness. 
The Indian Express is now on Telegram. Click here to join our channel ( @indianexpress ) and stay updated with the latest headlines 
For all the latest Explained News, download Indian Express App. 
В© The Indian Express ( P ) Ltd",https://indianexpress.com/article/explained/explained-what-is-cat-que-virus-does-it-infect-humans-6634674/,northern Vietnam,,01/10/2020 05:15,2020-09-30 07:19:48+00:00,de27fa2ff4a5,indianexpress.com,,1601457588,EN
YCKNNWIU3G,"Cat Que Virus From China Could Cause Another Disease in India, Says ICMR Amid COVID-19 Pandemic; Here's What it is And How it is Spreading","Cat Que Virus From China Could Cause Another Disease in India, Says ICMR Amid COVID-19 Pandemic; Here's What it is And How it is Spreading 
Pune, September 28: At the time when the world is battling with coronavirus, another virus from China called ` Cat Que Virus ' ( CQV ) reportedly has the potential to cause disease. ` Cat Que Virus ' was discovered by scientists at the Indian Council of Medical Research ( ICMR ). The virus falls under the category of Arthropod-borne viruses. It is found in pigs and culex mosquitoes, reported Hindustan Times. 
According to the report, Scientists at the National Institute of Virology ( NIV ), ICMR, Pune discovered antibodies for the virus. The antibodies were detected in two out of the 883 human serum sample tested at the laboratory. These two samples were detected from Karnataka. 
The two people were found to be positive for the presence of anti-CQV IgG antibodies in 2014 and 2017, reported the media house. According to ICMR scientists, availability of vector, primary mammalian host ( swine ) and confirmation of CQV from the jungle myna bird points to the presence of orthobunyavirus in the country. 
What is Cat Que Virus: 
According to US National Library of Medicine, Cat Que virus ( CQV ), a Simbu serogroup virus of the genus Orthobunyavirus ( family Bunyaviridae ), was first isolated in 2004 from mosquitoes during surveillance of arbovirus activity in acute pediatric encephalitis in northern Vietnam. The complete genome sequence of SC0806 isolated from mosquitoes ( Culex tritaeniorhynchus ) was found in Sichuan Province, China. 
`` Anti-CQV IgG antibody positivity in human serum samples tested and the replication capability of CQV in mosquitoes indicated a possible disease-causing potential of CQV in Indian scenario, '' reported Money Control quoting ICMR as saying. COVID-19, which originated in China's Wuhan city, has claimed over a million lives across the world. India is the second-worst-hit country with close to six million cases.",https://www.zee5.com/zeekannada/cat-que-virus-from-china-could-cause-another-disease-in-india-says-icmr-amid-covid-19-pandemic-heres-what-it-is-and-how-it-is-spreading/,northern Vietnam,,01/10/2020 05:15,2020-09-30 07:15:09+00:00,de27fa2ff4a5,www.zee5.com,,1601457309,EN
PKATMOYMH9,Tick-borne encephalitis in Denmark: New cases in Tisvilde Hegn and on the island of Falster,"By NewsDeskВ В @bactiman63
In the period from June to mid-August 2020, Statens Serum Institut detected three Tick-borne encephalitis (TBE) cases in patients who, with great certainty, were bitten by ticks in Tisvilde Hegn and the surrounding areas, but beyond the area where the natural playground is located. Additionally, a patient has become infected with TBE on the island of Falster.
Denmark/CIA
In 2019, Tisvilde Hegn and the surrounding areas were identified as a new TBE risk area. In the period from September to June 2019, four patients were thus diagnosed with TBE after being bitten with great certainty by TBEV-infected ticks in and around Tisvilde Hegn.
The SSI and the University of Copenhagen detected TBE in ticks from a popular natural playground in the north-eastern part of Tisvilde Hegn in 2019 as well as 2020. The ticks were collected by so-called вЂњflaggingвЂќ, i.e. dragging a piece of cloth across the vegetation.
In June, it was therefore decided to close the natural playground completely and to move it to a TBE-free area.
Following this measure, the period from June to mid-August 2020 brought an additional three cases of TBE in this area. All cases were observed in patients who very likely were bitten by ticks in Tisvilde Hegn and surroundings, beyond the area with the natural playground. The four patients are adults aged 40-76 years:
вЂњThe cases include three persons moving beyond the paths of the area while residing in the area, having stayed in a holiday residence or having stayed in the woods for a brief period of time. All of them have been admitted to hospital with typical TBE symptoms,вЂќ notes Staff Specialist Peter Henrik Andersen from the SSI.
The fourth TBE-infectee is a woman in her 60s from the island of Falster who was bitten by a tick in May, but who does not recall where she was when the bite occurred. She has only visited local woods on the island of Falster and has not been to Tisvilde Hegn or any other areas where TBE ticks have been found.
In Denmark, the island of Bornholm and Tisvilde Hegn and surrounding areas are considered TBE risk areas.
вЂњTBE vaccination should be considered particularly for persons who regularly spend time and who walk beyond established paths in woods and shrubbery, e.g., forestry workers, hunters, orienteers, mushroom and berry pickers and people who regularly engage in play, sports or other activities in the woods,вЂќ explains Peter Henrik Andersen.
The new case recently detected on the island of Falster indicates that TBE is still spreading geographically, in Denmark as well as in the rest of Europe.
вЂќWe must therefore accept that more and more TBE risk areas may appear across Denmark,вЂќ notes Peter Henrik Andersen.
Subscribe to Outbreak News TV",http://outbreaknewstoday.com/tick-borne-encephalitis-in-denmark-new-cases-in-tisvilde-hegn-and-on-the-island-of-falster-70603/,#,,01/11/2020 14:07,2020-09-30 05:00:00+00:00,de27fa2ff4a5,outbreaknewstoday.com,,1601449200,EN
