id,title,text,url,rse,source_lang,created_at,published_at,rssfeed_id,source,reference_id,publication_date,lang
7EHV4SOZJK,Researchers analyze data on RNA structure of tick-borne encephalitis virus,"Researchers analyze data on RNA structure of tick-borne encephalitis virus 
Researchers from Sechenov University together with colleagues from several Russian institutes analyzed data on the RNA structure of tick-borne encephalitis virus. 
Much larger than in previous studies, the data volume of the new study allowed them to estimate the age of the virus subtypes and track its spread in Eurasia. The results of the study were published in the journal Viruses. 
Tick-borne encephalitis is common in Central and Eastern Europe and a wide band in southern Siberia and the Far East. 
This disease is dangerous due to the ability of the virus to penetrate the brain and spinal cord, causing motor disorders, cognitive impairments and, in severe cases, paralysis and death. Every year in Russia, 1,500-2 ,000 people are infected, with about 30 % developing neurological complications and 20-100 people dying. 
The pathogen belongs to the genus Flavivirus ( it also includes Zika virus and the virus that causes dengue fever ) and is transmitted mainly through tick bites. There are three subtypes of the virus: Far Eastern, Siberian and European. 
Each of them is predominant in the region after which it is named, although this division is quite coarse - for example, cases of infection with the Siberian subtype were observed in the Baltic States and Sakhalin, and with the European one - in South Korea and the Altai Mountains. 
In recent years, the spread of the virus has expanded to northern areas ( Kola Peninsula, Arkhangelsk Region ) and mountainous regions ( in Central Europe and Italy ). In 2019, the first cases of infection were recorded in the UK and the Netherlands. 
To respond promptly to the emergence of the virus in new territories, it is necessary to understand what affects its spread and evolution. Existing studies provide different, sometimes contradictory results, but new data collected in recent years can clarify the situation. 
The authors of the article used Gen. 
Bank - a database that stores more than 200 million nucleotide sequences of RNA and DNA of various species. 
The data are supplied by scientists from different countries, and their volume is constantly growing, in common with the number of sequences describing the RNA of the tick-borne encephalitis virus - in ten years the number has increased fivefold. 
Using computer algorithms, researchers compared the RNA of viruses found in different years on the territory of several countries. 
Knowing the ` distance ' ( the proportion of divergent nucleotides ) between samples and the date of their receipt, one can estimate the time of divergence of species or the division of a species into subtypes. 
This method is based on the assumption that the sequence of nucleotides in a single species changes at an approximately constant rate, and is called the molecular clock. Using this method, scientists estimated the age of the most recent common ancestor for each of the subtypes. 
The result ( about 700 and 900 years for the Siberian and Far Eastern subtypes, respectively ) is consistent with earlier studies, while the age of the European subtype ( about 1,600 years ) was estimated for the first time after the virus was spotted in the Netherlands. 
The researchers also tried to find out how genetically similar viruses of the same subtype ended up in different countries at a distance of thousands of kilometres from each other. There are several possible explanations. 
First, viruses ( or ticks infected with them ) can travel long distances with animals, such as migratory birds or bats. Second, human activity can contribute to the spread of the virus: transportation of livestock or introduction of animals suitable for hunting in new territories. 

The most important result of the work was that most of the virus spreading events occurred in the last three or four centuries, and in many cases we have observed the transfer of the virus for thousands of kilometres in the last 50 - 100 years, and viruses in Europe have completely mixed over the last 100 - 200 years. ' 
Alexander Lukashev, Study Co-Author and Director of the Institute of Medical Parasitology and Tropical Medicine, Sechenov University 

` This allows us to consider tick-borne encephalitis as a highly dynamic disease, even as an emerging disease in many regions, and to think about an anthropogenic factor ( the spread of infected ticks as a result of transportation of domestic and wild animals ) as one of the main mechanisms behind the expansion of the virus. ' 
In addition, scientists have proposed an algorithm that simulates the compilation of samples as used in earlier studies. With its help, the authors of the article showed that the differences in results of previously published studies are well explained by the selection of the sequences included in the study. 
Source: Journal reference: Deviatkin, A. A., et al. ( 2020 ) Tick-Borne Encephalitis Virus: An Emerging Ancient Zoonosis? Viruses. doi.org/10.3390/v12020247.",https://www.news-medical.net/news/20200522/Researchers-analyze-data-on-RNA-structure-of-tick-borne-encephalitis-virus.aspx,"Central Europe, South Korea",,15/11/2020 16:44,2020-05-22 05:00:00+00:00,de27fa2ff4a5,www.news-medical.net,,1590130800,EN
70E450UBVU,Tick-borne encephalitis: 'Most of the virus spreading events occurred in the last three or four centuries' according to researchers,"Tick-borne encephalitis: ` Most of the virus spreading events occurred in the last three or four centuries ' according to researchers 
Researchers from Sechenov University together with colleagues from several Russian institutes analysed data on the RNA structure of tick-borne encephalitis virus. Much larger than in previous studies, the data volume of the new study allowed them to estimate the age of the virus subtypes and track its spread in Eurasia. The results of the study were published in the journal Viruses. 
Image/tetracarbon via pixabay 
Tick-borne encephalitis is common in Central and Eastern Europe and a wide band in southern Siberia and the Far East. This disease is dangerous due to the ability of the virus to penetrate the brain and spinal cord, causing motor disorders, cognitive impairments and, in severe cases, paralysis and death. Every year in Russia, 1,500-2 ,000 people are infected, with about 30 % developing neurological complications and 20-100 people dying. 
The pathogen belongs to the genus Flavivirus ( it also includes Zika virus and the virus that causes dengue fever ) and is transmitted mainly through tick bites. There are three subtypes of the virus: Far Eastern, Siberian and European. Each of them is predominant in the region after which it is named, although this division is quite coarse -- for example, cases of infection with the Siberian subtype were observed in the Baltic States and Sakhalin, and with the European one -- in South Korea and the Altai Mountains. In recent years, the spread of the virus has expanded to northern areas ( Kola Peninsula, Arkhangelsk Region ) and mountainous regions ( in Central Europe and Italy ). In 2019, the first cases of infection were recorded in the UK and the Netherlands. To respond promptly to the emergence of the virus in new territories, it is necessary to understand what affects its spread and evolution. Existing studies provide different, sometimes contradictory results, but new data collected in recent years can clarify the situation. 
The authors of the article used Gen. 
Bank -- a database that stores more than 200 million nucleotide sequences of RNA and DNA of various species. The data are supplied by scientists from different countries, and their volume is constantly growing, in common with the number of sequences describing the RNA of the tick-borne encephalitis virus -- in ten years the number has increased fivefold. 
Using computer algorithms, researchers compared the RNA of viruses found in different years on the territory of several countries. Knowing the ` distance ' ( the proportion of divergent nucleotides ) between samples and the date of their receipt, one can estimate the time of divergence of species or the division of a species into subtypes. This method is based on the assumption that the sequence of nucleotides in a single species changes at an approximately constant rate, and is called the molecular clock. Using this method, scientists estimated the age of the most recent common ancestor for each of the subtypes. The result ( about 700 and 900 years for the Siberian and Far Eastern subtypes, respectively ) is consistent with earlier studies, while the age of the European subtype ( about 1,600 years ) was estimated for the first time after the virus was spotted in the Netherlands. 
The researchers also tried to find out how genetically similar viruses of the same subtype ended up in different countries at a distance of thousands of kilometres from each other. There are several possible explanations. First, viruses ( or ticks infected with them ) can travel long distances with animals, such as migratory birds or bats. Second, human activity can contribute to the spread of the virus: transportation of livestock or introduction of animals suitable for hunting in new territories. 
` The most important result of the work was that most of the virus spreading events occurred in the last three or four centuries, and in many cases we have observed the transfer of the virus for thousands of kilometres in the last 50 - 100 years, and viruses in Europe have completely mixed over the last 100 - 200 years, ' said Alexander Lukashev, one of the authors of the work, Director of the Institute of Medical Parasitology and Tropical Medicine at Sechenov University. ` This allows us to consider tick-borne encephalitis as a highly dynamic disease, even as an emerging disease in many regions, and to think about an anthropogenic factor ( the spread of infected ticks as a result of transportation of domestic and wild animals ) as one of the main mechanisms behind the expansion of the virus. ' 
In addition, scientists have proposed an algorithm that simulates the compilation of samples as used in earlier studies. With its help, the authors of the article showed that the differences in results of previously published studies are well explained by the selection of the sequences included in the study. 
VIDEO",http://outbreaknewstoday.com/tick-borne-encephalitis-most-of-the-virus-spreading-events-occurred-in-the-last-three-or-four-centuries-according-to-researchers-57285/,South Korea,,16/09/2020 09:25,2020-05-21 05:00:00+00:00,de27fa2ff4a5,outbreaknewstoday.com,,1590044400,EN
Y302Y7PLGP,Tick-borne encephalitis spread across Eurasia with settlers and their pets and prey,"Tick-borne encephalitis spread across Eurasia with settlers and their pets and prey 
by Sechenov University 

Credit: CC0 Public Domain 

Researchers from Sechenov University together with colleagues from several Russian institutes analysed data on the RNA structure of tick-borne encephalitis virus. Much larger than in previous studies, the data volume of the new study allowed them to estimate the age of the virus subtypes and track its spread in Eurasia. The results of the study were published in the journal Viruses. 
Tick-borne encephalitis is common in Central and Eastern Europe and a wide band in southern Siberia and the Far East. This disease is dangerous due to the ability of the virus to penetrate the brain and spinal cord, causing motor disorders, cognitive impairments and, in severe cases, paralysis and death. Every year in Russia, 1,500-2 ,000 people are infected, with about 30 % developing neurological complications and 20-100 people dying. 
The pathogen belongs to the genus Flavivirus ( which also includes Zika virus and the virus that causes dengue fever ) and is transmitted mainly through tick bites. There are three subtypes of the virus: Far Eastern, Siberian and European. Each of them is predominant in the region after which it is named, although this division is quite rough -- for example, cases of infection with the Siberian subtype were observed in the Baltic States and Sakhalin, and with the European one -- in South Korea and the Altai Mountains. 
In recent years, the spread of the virus has expanded to northern areas ( Kola Peninsula, Arkhangelsk Region ) and mountainous regions ( in Central Europe and Italy ). In 2019, the first cases of infection were recorded in the UK and the Netherlands. To respond promptly to the emergence of the virus in new territories, it is necessary to understand what affects its spread and evolution. Existing studies provide different, sometimes contradictory results, but new data collected in recent years can clarify the situation. 
The authors of the article used Gen. 
Bank -- a database that stores more than 200 million nucleotide sequences of RNA and DNA of various species. The data are supplied by scientists from different countries, and their volume is constantly growing, in common with the number of sequences describing the RNA of the tick-borne encephalitis virus -- in ten years the number has increased fivefold. 
Using computer algorithms, researchers compared the RNA of viruses found in different years on the territory of several countries. Knowing the ` distance ' ( the proportion of divergent nucleotides ) between samples and the date of their receipt, one can estimate the time of divergence of species or the division of a species into subtypes. This method is based on the assumption that the sequence of nucleotides in a single species changes at an approximately constant rate, and is called the molecular clock. 

Using this method, scientists estimated the age of the most recent common ancestor for each of the subtypes. The result ( about 700 and 900 years for the Siberian and Far Eastern subtypes, respectively ) is consistent with earlier studies, while the age of the European subtype ( about 1,600 years ) was estimated for the first time after the virus was spotted in the Netherlands. 
The researchers also tried to find out how genetically similar viruses of the same subtype ended up in different countries at a distance of thousands of kilometres from each other. There are several possible explanations. First, viruses ( or ticks infected with them ) can travel long distances with animals, such as migratory birds or bats. Second, human activity can contribute to the spread of the virus: transportation of livestock or introduction of animals suitable for hunting in new territories. 
`` The most important result of the work was that most of the virus spreading events occurred in the last three or four centuries, and in many cases we have observed the transfer of the virus for thousands of kilometres in the last 50 - 100 years, and viruses in Europe have completely mixed over the last 100 - 200 years, '' said Alexander Lukashev, one of the authors of the work, Director of the Institute of Medical Parasitology and Tropical Medicine at Sechenov University. `` This allows us to consider tick-borne encephalitis as a highly dynamic disease, even as an emerging disease in many regions, and to think about an anthropogenic factor ( the spread of infected ticks as a result of transportation of domestic and wild animals ) as one of the main mechanisms behind the expansion of the virus. '' 
In addition, scientists have proposed an algorithm that simulates the compilation of samples as used in earlier studies. With its help, the authors of the article showed that the differences in results of previously published studies are well explained by the selection of the sequences included in the study. 

More information: 
Andrei A. Deviatkin et al, Tick-Borne Encephalitis Virus: An Emerging Ancient Zoonosis?, Viruses ( 2020 ). DOI: 10.3390 / v12020247 

Provided by 
Sechenov University 

Citation: 
Tick-borne encephalitis spread across Eurasia with settlers and their pets and prey ( 2020, May 21 ) 
retrieved 16 September 2020 
from https://medicalxpress.com/news/ 2020 - 05 - tick-borne-encephalitis-eurasia-settlers-pets.html 

This document is subject to copyright. Apart from any fair dealing for the purpose of private study or research, no 
part may be reproduced without the written permission. The content is provided for information purposes only.",https://medicalxpress.com/news/2020-05-tick-borne-encephalitis-eurasia-settlers-pets.html,"Eastern Europe, South Korea",,16/09/2020 09:25,2020-05-21 05:00:00+00:00,de27fa2ff4a5,medicalxpress.com,,1590044400,EN
3CEHHPWZIQ,"Moscow tick activity down, Lyme disease cases same as last year","Moscow tick activity down, Lyme disease cases same as last year 
By News. 
Desk @infectiousdiseasenews 
The Office of Rospotrebnadzor in the Moscow Region reported Monday on tick activity in the region ( computer translated ). As of May 14, 2020, 1,417 people went to health providers in the Moscow Region for medical assistance regarding tick bite cases, 518 of them were children. For the same period in 2019, 3731 complaints were registered, including 1135 among children. 
Ixodes scapularis, a Black-legged tick/CDC 
For prophylactic purposes, people traveling to tick-borne viral encephalitis endemic areas, as well as people at occupational risk groups working in natural biotopes, are vaccinated against tick-borne encephalitis. As of 05/14/2020, 1,119 people were vaccinated against tick-borne encephalitis, including 326 children. 
The results of laboratory studies of 353 ticks indicate the absence of tick-borne viral encephalitis pathogens in them. In 10 % of the studied ticks, pathogens of tick-borne tick-borne borreliosis were found, and in 3 % of human granulocytic anaplasmosis. 
In order to prevent infections transmitted by ixodid ticks, treatments were carried out in the area. 
Over the past 2020 period, 20 cases of Lyme disease were recorded, which corresponds to the same period in 2019. 
There were no cases of tick-borne viral encephalitis in the Moscow region. 

Aedes aegypti mosquito 

VIDEO",http://outbreaknewstoday.com/moscow-tick-activity-down-lyme-disease-cases-same-as-last-year-85212/,#,,16/09/2020 09:25,2020-05-19 05:00:00+00:00,de27fa2ff4a5,outbreaknewstoday.com,,1589871600,EN
U29GKHD0VS,"Maine Lyme disease: 'Providers are already reporting cases in 2020, and the number will rise as we enter the summer months'","By NewsDeskВ В @infectiousdiseasenewsВ 
The Maine Center for Disease Control and Prevention (Maine CDC) reported a record more than 2,000 Lyme disease cases in 2019 and officials announce during this Lyme Disease Awareness Month that providers are already reporting cases in 2020, and the number will rise as we enter the summer months.
This has prompted health officials to advise the public to be aware of tick bites that transmit not only Lyme disease, but also anaplasmosis ( a bacterial disease), babesiosis (a parasitic disease) and Powassan virus. Individuals bitten by the deer tick can acquire more than one infection.
Many individuals and families are spending more time outdoors during the COVID-19 pandemic. This may put them at increased risk of exposure to tickborne pathogens.
Symptoms of anaplasmosis include: fever, headache, malaise and body aches. Symptoms of babesiosis include: extreme fatigue, aches, fever, chills, sweating, dark urine, and possibly anemia. Symptoms of Powassan include: fever, headache, vomiting, weakness, confusion, loss of coordination, speech difficulties, seizures, and encephalitis and meningitis.
In 2019, providers reported 685 cases of anaplasmosis, 138 cases of babesiosis and two cases of Powassan.
What to do after a tick bite:
вЂў Remove the tick properly, ideally using tweezers or a tick spoon.
вЂў Clean the area around the bite.
вЂў Instruct the patient to watch for signs and symptoms for 30 days.
вЂў Identify the tick and the engorgement level, or the amount of time the tick was attached.
вЂў Testing of the tick is not routinely recommended for clinical purposes because even if the tick
tests positive for Lyme, that does not mean it was attached long enough to transmit the disease.
Even if the tick tests negative that does not mean it was a patientвЂ™s only exposure.

VIDEO
Maine reports fivefold increase in hepatitis A cases last year
Maine reports 1st Eastern Equine Encephalitis horse case since 2013
Powassan virus: Maine confirms 1st case since 2017",http://outbreaknewstoday.com/maine-lyme-disease-providers-are-already-reporting-cases-in-2020-and-the-number-will-rise-as-we-enter-the-summer-months-74705/,#,,16/09/2020 09:25,2020-05-14 05:00:00+00:00,de27fa2ff4a5,outbreaknewstoday.com,,1589439600,EN
Y23GYX94W4,"Number of COVID-19 patients in RussiaвЂ™s Far East exceeds 1,000","VLADIVOSTOK, May 13. /TASS/. The number of patients with confirmed COVID-19 in the Primorsky Region, in RussiaвЂ™s Far East, has risen by 52 over the past day to 1,007, the regional governmentвЂ™s press service reported on Wednesday.
""As of May 13, the number of those infected with the coronavirus in the Primorsky Region exceeded 1,000. Over the past day, the number of patients with COVID-19 has risen by 52. The regional crisis center reported that since the start of the epidemic some 1,007 residents of the region have been diagnosed with the coronavirus,"" the statement said.
Some fourteen patients in infectious disease hospitals remain in grave condition and they have been connected to lung ventilators. Forty-three patients are in serious condition, and 19 of them have complications related to the coronavirus.
Over the past day 28 people have been discharged from hospitals after successful treatment. The total number of coronavirus patients who recovered is estimated at 268.
Wearing face masks is compulsory in the region and self-isolation measures have been extended until June 1. A number of enterprises continue working in the region. Authorities in Nakhodka, which has reported the biggest number of COVID-19 cases, have introduced restrictions on entering or leaving the city.
In late December 2019, Chinese officials notified the World Health Organization (WHO) about the outbreak of a previously unknown pneumonia in the city of Wuhan, in central China. Since then, cases of the novel coronavirus - named COVID-19 by the WHO - have been reported in every corner of the globe, including Russia.
On March 11, 2020, the WHO declared the coronavirus outbreak a pandemic. According to the latest statistics, over 4,269,000 people have been infected worldwide and more than 287,000 deaths have been reported. In addition, so far, over 1,534,000 individuals have recovered from the illness across the globe.
To date, a total of 232,243 coronavirus cases have been confirmed in Russia, with 43,512 patients having recovered from the virus. RussiaвЂ™s latest data indicates 2,116 fatalities nationwide. Earlier, the Russian government set up an Internet hotline to keep the public updated on the coronavirus situation.",https://tass.com/society/1155717,"Central China, center Vladivostok",,11/10/2020 10:22,2020-05-13 00:57:13+00:00,ee94b68e6e0f,tass.com,,1589338633,EN
X1CV53IH8N,Atlanta Braves: Divisional shifts amid coronavirus pandemic 'not happening',"В© Brett Davis-USA TODAY Sports
 The Atlanta Braves aren't interested in a solution to play the 2020 season that would have them playing in a Central Division.

In late April, Bob Nightengale of USA Today reported that Major League Baseball was considering shifting clubs to geographically-based divisions for a shortened 2020 season so games could occur during the coronavirus pandemic. Nightengale added that the Atlanta Braves would move to a Central division as part of the theoretical realignment. On Thursday, Braves chairman Terry McGuirk offered a retort to those rumors when speaking with Mark Bradley of The Atlanta Journal-Constitution. ""That is not happening,"" McGuirk said. ""There is no possibility of that happening. It has never been discussed by Major League Baseball.""McGuirk continued: ""We live in the East. We play in the East. Our travel will be in the East. WeвЂ™re an Eastern division team, and thatвЂ™s where weвЂ™ll stay.""He did, however, admit that concerns about travel could alter a schedule that's been affected by the virus outbreak since March.В Earlier this week, former MLB player Trevor Plouffe and Ken Rosenthal of The Athletic reported on the possibility that some sort of season could get underway on July 1. Neither the league nor the MLB Players Association offered official comments on those rumors, nor have the parties announced an agreement for the resumption of spring training activities.В On Wednesday, Boston Red Sox pitcher Collin McHugh spoke out against the idea of playing amid the pandemic.В Subscribe to Yardbarker's Morning Bark, the most comprehensive newsletter in sports. Customize your email to get the latest news on your favorite sports, teams and schools. Emailed daily. Always free! Sign up now в–ёMore must-reads:Related slideshow: A player we'll miss most from every team during MLB hiatus (Provided by Yardbarker)",https://www.msn.com/en-us/sports/mlb/atlanta-braves-divisional-shifts-amid-coronavirus-pandemic-not-happening/ar-BB13KZoh,#,,16/09/2020 15:28,2020-05-07 05:00:00+00:00,ee94b68e6e0f,www.msn.com,,1588834800,EN
