id,title,text,url,rse,source_lang,created_at,published_at,rssfeed_id,source,reference_id,publication_date,lang
5CMU4ULN4Y,Avalanches kill 10 in mountainous area near IranвЂ™s capital,"The Canadian PressBeijing has urged residents not to leave the city during the Lunar New Year holiday in February, implementing new restrictions after several coronavirus infections last week.Two domestic cases were reported on Friday, a convenience store worker and a Hewlett Packard Enterprise employee. Another two asymptomatic cases were discovered in Beijing earlier in the week.Beijing is conducting testing on a limited scale in the neighbourhoods and workplaces where the cases were found.To contain any new outbreaks, the Beijing government cancelled big gatherings such as sports events and temple fairs. It says applications will be strictly reviewed for any major events. Venues such as cinemas, libraries and museums have to operate at 75% capacity, the government said.It also called on companies not to arrange business trips outside the city and abroad.Lunar New Year is Feb. 12.Separately, officials in the northeastern port city of Dalian said Friday that they had tested over 4.75 million people for the coronavirus after 24 confirmed infections this month.Authorities have shut schools and all public spaces in five neighbourhood divisions in Dalian, and only essential workers can leave their compounds to go to work.Elsewhere in the Asia-Pacific region:вЂ” JapanвЂ™s health ministry said Saturday it has confirmed a variant of the coronavirus that has spread across Britain in two Tokyo residents вЂ” the first two cases of the new variant found outside of Japanese airports. A man in his 30s tested positive for the new variant Saturday after returning from Britain on Dec. 16, the ministry said in a statement. A second patient is a woman in her 20s who is related to the man. The confirmation come a day after the ministry said it had detected the first cases of the variant in five returnees from Britain who tested positive when they arrived at Japanese airports between Dec. 18 and Dec. 21. Also Saturday, Tokyo confirmed 949 new cases of the coronavirus, a record high for the Japanese capital, as the country struggles with an upsurge that is spreading nationwide. The Tokyo Metropolitan Government said the additional cases bring the prefectural total to 55,851. Japan had 3,823 new cases Friday for a national total of 213,547, with 3,155 deaths, the health ministry said.вЂ” South Korea has reported another 1,132 coronavirus cases as the resurgence worsened over the Christmas week, putting pressure on the government to enforce stricter social distancing controls. The figures on Saturday brought the countryвЂ™s caseload to 55,902 with 793 deaths. Around 780 of the new cases were from the greater capital area, home to 26 million people, where health workers discovered a large cluster in a huge Seoul prison with more than 500 inmates and workers. Transmissions in recent weeks have also been tied to hospitals, nursing homes, churches, restaurants and army units. After months of complacency, government officials restored some distancing restrictions in recent weeks after easing them to the lowest tier in October and are now clamping down on private gatherings, shutting down ski resorts, restricting hotel occupancy and setting fines for restaurants if they accept large groups. The government will hold a meeting on Sunday to determine whether to elevate distancing controls to the highest вЂњTier-3,вЂќ which could possibly shutter hundreds of thousands of non-essential businesses. Officials have resisted such action for weeks, saying it could unleash further shock on an already weak economy.вЂ” Health officials in Thailand say two new clusters of coronavirus cases have been found that appear to be linked to a major outbreak discovered a week earlier among migrant workers in an industrial province near Bangkok. The new cases were found in 19 members of a motorcycling club who held a holiday gathering on Lanta island in the southern province of Krabi, and in nine people who were in a gambling den in the eastern province of Rayong. On Saturday morning, 110 new coronavirus cases were reported, bringing ThailandвЂ™s total to 6,020. Sixty of the 110 were linked to the outbreak among migrant workers.___Follow APвЂ™s coverage at https://apnews.com/hub/coronavirus-pandemic, https://apnews.com/hub/coronavirus-vaccine and https://apnews.com/UnderstandingtheOutbreakThe Associated Press",https://ca.news.yahoo.com/avalanches-kill-10-mountainous-area-062639334.html,"near Bangkok, southern Krabi, eastern province of Rayong, South Korea",,27/12/2020 14:58,2020-12-27 06:18:00+00:00,ee94b68e6e0f,ca.news.yahoo.com,,1609053480,EN
5CU0N7S97R,Alberta paramedics push for place on COVID-19 vaccine priority list,"CBCOntario announced on Saturday its first two confirmed cases in the province of the COVID-19 variant, first identified in the United Kingdom. Ontario is the first province to identify the new COVID-19В variant. The confirmed cases identified are from a couple from Durham Region with no known travel history, exposure or high-risk contacts, Dr. Barbara Yaffe, Ontario's associate chief medical officer of health, saidВ in a news release on Saturday. Durham Region is east of Toronto. Both individuals have been informed and are now in self-isolation as per public health protocols, it said. ""This further reinforces the need for Ontarians to stay home as much as possible and continue to follow all public health advice, including the provincewide shutdown measures beginning today,"" YaffeВ said. ""Durham Region Health Department has conducted case and contact investigation and Ontario is working in collaboration with our federal counterparts at the Public Health Agency of Canada."" TheВ variant has now been detected in multiple countries beyond Britain, including Denmark, Belgium, Australia and the Netherlands. With inbound international travel, it is not unexpected to have identified the new variant in Ontario, the news release said. No evidence new variant more severe: PHAC The federal governmentВ currently has aВ monitoring program in place with the provinces and territories to identifyВ new COVID-19 variantsВ in the country, such as the ones identified in the United Kingdom and South Africa. ""While early data suggests that these new variants may be more transmissible, to date there is no evidence that they cause more severe disease or have any impact on antibody response or vaccine effectiveness,"" the Public Health Agency of Canada (PHAC) said in a statement on Saturday. ""More research is required to confirm these findings, and the Canadian and global medical, public health and research communities are actively evaluating these mutations."" As monitoring continues, PHAC saysВ it is expected that other cases of this variant, along withВ other variants of concern,В will be found in Canada. ""Furthermore, as these two cases did not travel outside of Canada, it is important to follow public health measures and limit contacts with others, to reduce the transmission of the virus and any of its variants in communities,"" it said. ""Recognizing the potential increased risk that inbound international travellers may pose with this new variant, the province continues to call on the federal government to urgently partner with Ontario to implement testing at Toronto Pearson International Airport."" Earlier this week, Ontario Premier Doug Ford said the federal government wasn't doing enough to protect Ontario from international travellers, suggesting they'reВ a problematic source of COVID-19 spread in the province. However, based on the provincial government's own statistics, travel-related COVID-19 cases represent a small number of infections. ""Regardless of whether federal support is forthcoming, the Ontario government is prepared to act on its own to implement an airport testing program,"" the news release said. Ontario under provincewide lockdown starting Saturday Ontario entered a provincewide lockdownВ at 12:01 a.m. on Boxing Day in a bid to curb the spread of the novel coronavirus. The province has reported more than 2,000 cases 12 days in a row, including 2,142 new positive tests on Saturday and 2,159 cases onВ Christmas Day. During those days, Ontario reportedВ 81 additional deaths. The new measures mean restaurants in the province can only provide takeout and delivery.",https://ca.news.yahoo.com/alberta-paramedics-push-place-covid-030824196.html,east Toronto,,27/12/2020 14:58,2020-12-25 02:08:00+00:00,ee94b68e6e0f,ca.news.yahoo.com,,1608865680,EN
VVAGO9C1IG,Correction: Report of transactions of shares and related securities of Bavarian Nordic by persons holding managerial responsibilities and/or persons/companies closely associated with such,"Correction: Report of transactions of shares and related securities of Bavarian Nordic by persons holding managerial responsibilities and/or persons/companies closely associated with such 
ReutersU.S. President-elect Joe Biden's top aide Ron Klain on Sunday urged Congress to pass bipartisan COVID-19 financial relief as a surge in cases shattered U.S. records and strained hospitals nationwide, and called for immediate action to allow his team to coordinate with the outgoing Trump administration. Other top Biden advisers also stressed the need to control the spiraling outbreak now, even before Biden takes office on Jan. 20, saying the next few weeks were critical and warning that local healthcare systems were at a tipping point. `` We are in a very dangerous period, '' Dr. Michael Osterholm, a member of Biden's COVID-19 Advisory Board and director of the Center for Infectious Disease Research and Policy at the University of Minnesota, told NBC News ' `` Meet the Press '' program.",https://uk.finance.yahoo.com/news/correction-report-transactions-shares-related-112100860.html,#,,15/11/2020 16:44,2020-11-13 10:21:00+00:00,de27fa2ff4a5,uk.finance.yahoo.com,,1605266460,EN
LJOMHI8JLB,Most dangerous countries from diseases for US travelers named,"Most dangerous countries from diseases for US travelers named 
Research has revealed which countries pose the greatest threat to the American travelers from diseases. 
Data1 from the World Health Organization ( WHO ) shows the worst countries for disease outbreaks, with a number of hotspots revealed across the world alongside the threat of COVID-19. 

The study, Wrath of Diseases, delves into 24 years and more than 2,800 disease outbreaks to reveal the most common infectious diseases and the countries that pose the biggest threats. 
High Risk Countries 

Data shows that six of the top 10 countries which have the highest number of outbreaks are in Africa, with a combined 1,060 outbreaks happening in the continent over the last three decades. 
The WHO defines an outbreak as the occurrence of disease cases over normal expectancy caused by an infection, transmitted through person-to-person contact, animal-to-person contact, or from the environment or other media2. 
The country with the highest risk is the Democratic Republic of Congo, with 242 outbreaks recorded in the African nation since 1996. Throughout 2020, as well as dealing with the threat of Covid-19, DR Congo has battled 110 cases of Ebola which has led to 47 deaths. 
China, which reported the first instance of Covid-19, has seen 184 outbreaks in the last 24 years, followed by Indonesia ( 147 outbreaks ), Egypt ( 114 outbreaks ), and Uganda ( 77 outbreaks ) also making up the top five countries. 
Ranked at number eight, the US has had 52 reported outbreaks since 1996, with more outbreaks reported than neighboring countries, Canada ( 21 outbreaks ) and Mexico ( 9 outbreaks ). 
Table of most dangerous countries: 

The data also reveals that there are 26 countries that have only had one outbreak in the past three decades with the Caribbean ranked as one of the safest areas in the world. 
The six luxury destinations of Barbados, Saint Vincent and the Grenadines, St Lucia, St Martin, Suriname, Trinidad and Tobago have seen only one disease outbreak each since 1996. 
Global Recurring Outbreaks 
While outbreaks in the US are actually ranked as some of the most common around the globe, thankfully some of the more widespread and lethal outbreaks are less likely to be found in America and its neighbouring countries. 
Across the globe, the most frequent outbreak in the last 24 years has been Avian influenza which has seen 607 outbreaks. This is followed by Middle East respiratory syndrome ( MERs ) with 298 outbreaks, Ebola ( 295 ), Cholera ( 279 ), and Yellow Fever ( 167 ). 

Most Common US Outbreaks 
The research also provides a breakdown of which outbreaks have been the most prominent in the US over the three decades. 
Anthrax has been the most common outbreak across the nation with 16 registered incidences, the US reported an outbreak in 2001 which resulted in five deaths among 23 cases. Anthrax is a disease caused by a bacterium ( Bacillus anthracis ) and people can get sick with anthrax after encountering infected animals or animal products. It has also been associated with acts of bioterrorism via contaminated mail. 
The second most common is West Nile disease which has seen 11 outbreaks across the country and, in 2002, was responsible for 211 deaths with 3,587 cases across 39 states. This is followed by Swine Flu with four outbreaks, Zika Virus ( 3 ), and St Louis Encephalitis ( 2 ). 
Important reasons to note for these global outbreaks include climate change, for example, extreme weather events such as storms and floods are often followed by an increase in infectious diseases. 
Outbreaks of diarrheal and respiratory illnesses can occur when access to clean water and sewage systems are disrupted and people are living in crowded conditions. 
A temperature rise may also increase the spread of vector-borne infections such as malaria, dengue, Zika, and yellow fever. Other factors such as urbanization, population growth and an increase in antimicrobial resistance will also impact the spike in outbreaks arising. 
Certain areas of the world are also experiencing rapid population growth. For example, the population of Sub-Saharan Africa, for instance, is increasing at a rate of 2.65 % per year -- more than twice the highest rate of population growth experienced by high-income countries since the 1950s. 
Rapidly growing populations may increase the risk of infection due to poor sanitation, high population density and limited healthcare access. 
It is very difficult to predict, however it is likely that new diseases will continue to emerge. The greatest challenge may be anticipating the next new infection and the difficulty in containing the spread of these infections.",https://www.eturbonews.com/1672704/most-dangerous-countries-from-diseases-for-us-travelers-named/,#,,15/11/2020 16:44,2020-11-12 23:36:23+00:00,de27fa2ff4a5,www.eturbonews.com,,1605227783,EN
E4EK7I7YOV,First-of-Its-Kind Synthetic DNA Vaccine Tested Against Powassan Virus,"First-of-Its-Kind Synthetic DNA Vaccine Tested Against Powassan Virus 
Scientists at The Wistar Institute have designed and tested the first-of-its-kind synthetic DNA vaccine against Powassan virus ( POWV ), targeting portions of the virus envelope protein. A rapidly reemerging tick-borne disease, POWV has been reported to be fatal in 10 % of infected people with detrimental neurological consequences including encephalitis and meningitis. This new POWV vaccine candidate, described in a paper published today in PLOS Neglected Infectious Diseases, is one of many emerging infectious disease DNA vaccine discoveries being advanced by the Vaccine and Immunotherapy Center at The Wistar Institute. Unlike the widely recognized Lyme disease, POWV causes a little known, potentially deadly infectious disease that is transmitted through tick bites during fall and spring seasons. POWV is an RNA virus belonging to the flavivirus family, the same as Zika virus, but passed to people by ticks instead of mosquitoes. Transmission can occur rapidly and symptoms including flu-like fever, body aches, skin rash, and headaches can present anytime during the 1 - 4 week incubation period. Although still considered relatively rare, in recent years the number of reported cases of people sick from Powassan virus has been increasing in North America, including infecting former U.S. Senator Kay Hagan who contracted Powassan virus and died from the disease. There are no vaccines or therapies available to treat or prevent this emerging infection. Kar Muthumani, Ph.D., former associate professor and director of the Laboratory of Emerging Infectious Diseases at The Wistar Institute, * and senior author on the study, collaborated with the laboratory of David B. Weiner, Ph.D., executive vice president and director of Wistar's Vaccine and Immunotherapy Center, to design and test this synthetic DNA vaccine. The effectiveness of this vaccine was evaluated in preclinical studies that showed a single immunization elicited broad T and B cell immune responses in mice similar to those induced naturally in POWV-infected individuals, and that vaccine-induced immunity provided protection in a POWV challenge animal model. `` The significant protection in mice demonstrated by our vaccine is highly encouraging and strongly supports the importance of this vaccine approach for further study, '' said Muthumani. Residents of and visitors in POWV-endemic areas are considered at risk of infection, especially during outdoor work and recreational activities. In the U.S., cases of POWV disease have been reported in Northeastern states and the Great Lakes region. `` Given the risk of serious complications from POWV and the 300 % increase in incidence of POWV infection over the past 16 years, we will continue efforts to advance this urgently needed emerging infectious disease vaccine candidate towards the clinic, '' said Weiner. Reference: Choi H, Kudchodkar SB, Ho M, et al.. A novel synthetic DNA vaccine elicits protective immune responses against Powassan virus. PLOS Neglected Tropical Diseases. 2020; 14 ( 10 ): e0008788. doi :10.1371 / journal.pntd .0008788. This article has been republished from the following materials. Note: material may have been edited for length and content. For further information, please contact the cited source.",https://www.technologynetworks.com/analysis/news/first-of-its-kind-synthetic-dna-vaccine-tested-against-powassan-virus-342239,North America,,02/11/2020 10:59,2020-11-02 08:37:54+00:00,de27fa2ff4a5,www.technologynetworks.com,,1604309874,EN
DWW6MWNDDA,First-of-Its-Kind Synthetic DNA Vaccine Tested Against Powassan Virus,"Scientists at The Wistar Institute have designed and tested the first-of-its-kind synthetic DNA vaccine against Powassan virus (POWV), targeting portions of the virus envelope protein. A rapidly reemerging tick-borne disease, POWV has been reported to be fatal in 10% of infected people with detrimental neurological consequences including encephalitis and meningitis. This new POWV vaccine candidate, described in a paper published today inВ PLOS Neglected Infectious Diseases, is one of many emerging infectious disease DNA vaccine discoveries being advanced by the Vaccine and Immunotherapy Center at The Wistar Institute.Unlike the widely recognized Lyme disease, POWV causes a little known, potentially deadly infectious disease that is transmitted through tick bites during fall and spring seasons. POWV is an RNA virus belonging to the flavivirus family, the same as Zika virus, but passed to people by ticks instead of mosquitoes. Transmission can occur rapidly and symptoms including flu-like fever, body aches, skin rash, and headaches can present anytime during the 1-4 week incubation period. Although still considered relatively rare, in recent years the number of reported cases of people sick from Powassan virus has been increasing in North America, including infecting former U.S. Senator Kay Hagan who contracted Powassan virus and died from the disease. There are no vaccines or therapies available to treat or prevent this emerging infection. Kar Muthumani, Ph.D., former associate professor and director of the Laboratory of Emerging Infectious Diseases at The Wistar Institute,* and senior author on the study, collaborated with the laboratory ofВ David B. Weiner, Ph.D.,В executive vice president and director of WistarвЂ™s Vaccine and Immunotherapy Center, to design and test this synthetic DNA vaccine. The effectiveness of this vaccine was evaluated in preclinical studies that showed a single immunization elicited broad T and B cell immune responses in mice similar to those induced naturally in POWV-infected individuals, and that vaccine-induced immunity provided protection in a POWV challenge animal model.вЂњThe significant protection in mice demonstrated by our vaccine is highly encouraging and strongly supports the importance of this vaccine approach for further study,вЂќ said Muthumani. Residents of and visitors in POWV-endemic areas are considered at risk of infection, especially during outdoor work and recreational activities. In the U.S., cases of POWV disease have been reported in Northeastern states and the Great Lakes region.вЂњGiven the risk of serious complications from POWV and the 300% increase in incidence of POWV infection over the past 16 years, we will continue efforts to advance this urgently needed emerging infectious disease vaccine candidate towards the clinic,вЂќ said Weiner.Reference: Choi H, Kudchodkar SB, Ho M, et al. A novel synthetic DNA vaccine elicits protective immune responses against Powassan virus. PLOS Neglected Tropical Diseases. 2020;14(10):e0008788. doi:10.1371/journal.pntd.0008788.This article has been republished from the following materials. Note: material may have been edited for length and content. For further information, please contact the cited source.",https://www.technologynetworks.com/biopharma/news/first-of-its-kind-synthetic-dna-vaccine-tested-against-powassan-virus-342239,North America,,20/12/2020 14:02,2020-11-02 07:00:00+00:00,de27fa2ff4a5,www.technologynetworks.com,,1604304000,EN
