id,title,text,url,rse,source_lang,created_at,published_at,rssfeed_id,source,reference_id,publication_date,lang
EEGNKNFRUY,Holtsville mosquito sample among 16 in Suffolk to test positive for West Nile virus,"Holtsville mosquito sample among 16 in Suffolk to test positive for West Nile virus 
HOLTSVILLE, NY ( On. 
Sachem.com / On. 
TownMedia.com ) -- Another mosquito sample from Holtsville has tested positive for West Nile virus. The sample was among six positives from the most - recently announced tests for the virus from across Suffolk County, health officials announced late Monday afternoon. Suffolk County Health Commissioner Dr. Gregson Pigott announced the six mosquito samples to test positive were collected on Sept. 1 from Holtsville, Northport, Port Jefferson Station, Setauket, Stony Brook, and West Babylon. `` The confirmation of West Nile virus in mosquito samples indicates the presence of West Nile virus in the area, '' said Pigott. `` While there is no cause for undue concern, we advise residents to cooperate with us in our efforts to reduce exposure to West Nile virus and other mosquito-borne diseases. '' West Nile virus across Sachem. 
In the Sachem area before today's announcement, the most - recent samples to test positive came from Farmingville and Holtsville during sample testing from Aug. 25 to 27. The first positive within Sachem came from a Holtsville sample collected in mid-July. That was followed by another sample in neighboring North Patchogue, just outside Sachem, during the following week, and more positives from Farmingville on Aug. 6. and Aug. 19 and 20. West Nile virus across Suffolk County. 
To date this season, 82 mosquito samples and four birds have tested positive for West Nile virus. Prior to today's announcement of six positives, there 16 positives reported -- the most at one one time so far this year -- on Sept. 4 from collections taken Aug. 25 to 27. Fourteen positives reported on Aug. 27 from collections on Aug. 19 and 20 in Bay Shore, Brentwood, Cold Spring Harbor, Farmingville, Islip, Lindenhurst, Northport, Rocky Point, Stony Brook, and West Babylon. Nine positives were announced on Aug. 21 from collections on Aug. 11 and 12 in Bay Shore, Cold Spring Harbor, Copiague, Greenlawn, Northport, West Babylon, and West Islip. Fourteen positives were announced on Aug. 13 from collections on Aug. 6 from Bay Shore, Bohemia, Brentwood, Cold Spring Harbor, Copiague, Farmingville, Northport, and West Islip. On Aug. 6, five positive samples were announced from samples collected on July 28 in Bay Shore, Brentwood, Greenlawn, and Northport. Fifteen positive samples were reported on July 30 from collections on July 21 and 22. Those positives came from Bay Shore, Brentwood, Great River, Huntington Station, Islip, North Patchogue, Stony Brook, and West Babylon. On July 24, Pigott said two samples tested positive from samples collection on July 14 and 15 in Bay Shore and Holtsville. Those positives followed the county's July 16 announcement of the season's first positive sample, which came from a July 9 collection in Bay Shore. Health impacts of West Nile virus. 
There has not yet been a human case this year in Suffolk County. The county reported two human cases in September 2019. In those cases, one person developed symptoms and was hospitalized for several days before being discharged. The second individual was hospitalized with West Nile encephalitis and was also discharged. West Nile virus was first detected in birds and mosquito samples in Suffolk County in 1999 and again each year thereafter. The virus is transmitted to humans by the bite of an infected mosquito. Most people infected with West Nile virus will experience mild or no symptoms, but some can develop severe symptoms including high fever, headache, neck stiffness, stupor, disorientation, coma, tremors, convulsions, muscle weakness, vision loss, numbness and paralysis, according to the health department. The symptoms may last several weeks, and neurological effects may be permanent. Individuals, especially those 50 years of age or older, or those with compromised immune systems, who are most at risk, are urged to take precautions to avoid being bitten by mosquitoes. Avoid mosquito bites to prevent West Nile virus. 
Pigott offers the following tips to avoid mosquito bites: вЂў Minimize outdoor activities between dusk and dawn. вЂў Wear shoes and socks, long pants and long-sleeved shirts when mosquitoes are active. вЂў Use mosquito repellent, following label directions carefully. вЂў Make sure all windows and doors have screens, and that all screens are in good repair. вЂў Keep mosquitoes from laying eggs inside and outside of your home. Once a week, empty and scrub containers that hold water, such as vases, pet water bowls, flower pot saucers, discarded tires, buckets, pool covers, birdbaths, trash cans, and rain barrels. Download a copy of Suffolk County's informational brochure `` Get the Buzz on Mosquito Protection, '' available in English and Spanish, and share it with your community, the health department encouraged. 

Protect yourself from mosquito bites by dumping standing water on your property, according to the Suffolk County Department of Health Services. Even small amounts of water can act as breeding sites for mosquitoes. 

Suffolk County Department of Health Services 

Report dead birds and mosquito problems. 
Dead birds may indicate the presence of West Nile virus in the area. To report dead birds, call the Bureau of Public Health Protection at 631-852-5999 from 9 a.m. to 4 p.m., Monday through Friday. Residents are encouraged to take a photograph of any bird in question. To report mosquito problems or stagnant pools of water, call the Department of Public Works ' Vector Control Division at 631-852-4270. For further information on West Nile virus, visit the Department of Health Services ' website.",https://www.ontownmedia.com/news/holtsville-mosquito-sample-among-16-in-suffolk-to-test-positive-for-west-nile-virus/article_c50022b4-f6d0-11ea-9611-2f0d334fde2c.html,"West Babylon, West Babylon, West Babylon, West Babylon, North Patchogue, North Patchogue, Outside Sachem, West Islip, West Islip",,16/09/2020 09:25,2020-09-14 19:37:00+00:00,de27fa2ff4a5,www.ontownmedia.com,,1600119420,EN
SQQQPI14FB,Holtsville mosquito sample among six in Suffolk to test positive for West Nile virus,"Holtsville mosquito sample among six in Suffolk to test positive for West Nile virus 
HOLTSVILLE, NY ( On. 
Sachem.com / On. 
TownMedia.com ) -- Another mosquito sample from Holtsville has tested positive for West Nile virus. The sample was among six positives from the most - recently announced tests for the virus from across Suffolk County, health officials announced late Monday afternoon. Suffolk County Health Commissioner Dr. Gregson Pigott announced the six mosquito samples to test positive were collected on Sept. 1 from Holtsville, Northport, Port Jefferson Station, Setauket, Stony Brook, and West Babylon. `` The confirmation of West Nile virus in mosquito samples indicates the presence of West Nile virus in the area, '' said Pigott. `` While there is no cause for undue concern, we advise residents to cooperate with us in our efforts to reduce exposure to West Nile virus and other mosquito-borne diseases. '' West Nile virus across Sachem. 
In the Sachem area before today's announcement, the most - recent samples to test positive came from Farmingville and Holtsville during sample testing from Aug. 25 to 27. The first positive within Sachem came from a Holtsville sample collected in mid-July. That was followed by another sample in neighboring North Patchogue, just outside Sachem, during the following week, and more positives from Farmingville on Aug. 6. and Aug. 19 and 20. West Nile virus across Suffolk County. 
To date this season, 82 mosquito samples and four birds have tested positive for West Nile virus. Prior to today's announcement of six positives, there 16 positives reported -- the most at one time so far this year -- on Sept. 4 from collections taken Aug. 25 to 27. Fourteen positives reported on Aug. 27 from collections on Aug. 19 and 20 in Bay Shore, Brentwood, Cold Spring Harbor, Farmingville, Islip, Lindenhurst, Northport, Rocky Point, Stony Brook, and West Babylon. Nine positives were announced on Aug. 21 from collections on Aug. 11 and 12 in Bay Shore, Cold Spring Harbor, Copiague, Greenlawn, Northport, West Babylon, and West Islip. Fourteen positives were announced on Aug. 13 from collections on Aug. 6 from Bay Shore, Bohemia, Brentwood, Cold Spring Harbor, Copiague, Farmingville, Northport, and West Islip. On Aug. 6, five positive samples were announced from samples collected on July 28 in Bay Shore, Brentwood, Greenlawn, and Northport. Fifteen positive samples were reported on July 30 from collections on July 21 and 22. Those positives came from Bay Shore, Brentwood, Great River, Huntington Station, Islip, North Patchogue, Stony Brook, and West Babylon. On July 24, Pigott said two samples tested positive from samples collection on July 14 and 15 in Bay Shore and Holtsville. Those positives followed the county's July 16 announcement of the season's first positive sample, which came from a July 9 collection in Bay Shore. Health impacts of West Nile virus. 
There has not yet been a human case this year in Suffolk County. The county reported two human cases in September 2019. In those cases, one person developed symptoms and was hospitalized for several days before being discharged. The second individual was hospitalized with West Nile encephalitis and was also discharged. West Nile virus was first detected in birds and mosquito samples in Suffolk County in 1999 and again each year thereafter. The virus is transmitted to humans by the bite of an infected mosquito. Most people infected with West Nile virus will experience mild or no symptoms, but some can develop severe symptoms including high fever, headache, neck stiffness, stupor, disorientation, coma, tremors, convulsions, muscle weakness, vision loss, numbness and paralysis, according to the health department. The symptoms may last several weeks, and neurological effects may be permanent. Individuals, especially those 50 years of age or older, or those with compromised immune systems, who are most at risk, are urged to take precautions to avoid being bitten by mosquitoes. Avoid mosquito bites to prevent West Nile virus. 
Pigott offers the following tips to avoid mosquito bites: вЂў Minimize outdoor activities between dusk and dawn. вЂў Wear shoes and socks, long pants and long-sleeved shirts when mosquitoes are active. вЂў Use mosquito repellent, following label directions carefully. вЂў Make sure all windows and doors have screens, and that all screens are in good repair. вЂў Keep mosquitoes from laying eggs inside and outside of your home. Once a week, empty and scrub containers that hold water, such as vases, pet water bowls, flower pot saucers, discarded tires, buckets, pool covers, birdbaths, trash cans, and rain barrels. Download a copy of Suffolk County's informational brochure `` Get the Buzz on Mosquito Protection, '' available in English and Spanish, and share it with your community, the health department encouraged. 

Protect yourself from mosquito bites by dumping standing water on your property, according to the Suffolk County Department of Health Services. Even small amounts of water can act as breeding sites for mosquitoes. 

Suffolk County Department of Health Services 

Report dead birds and mosquito problems. 
Dead birds may indicate the presence of West Nile virus in the area. To report dead birds, call the Bureau of Public Health Protection at 631-852-5999 from 9 a.m. to 4 p.m., Monday through Friday. Residents are encouraged to take a photograph of any bird in question. To report mosquito problems or stagnant pools of water, call the Department of Public Works ' Vector Control Division at 631-852-4270. For further information on West Nile virus, visit the Department of Health Services ' website.",https://www.ontownmedia.com/news/holtsville-mosquito-sample-among-six-in-suffolk-to-test-positive-for-west-nile-virus/article_c50022b4-f6d0-11ea-9611-2f0d334fde2c.html,"West Babylon, West Babylon, West Babylon, North Patchogue, North Patchogue, Outside Sachem, West Islip, West Islip",,19/09/2020 02:50,2020-09-14 19:37:00+00:00,de27fa2ff4a5,www.ontownmedia.com,,1600119420,EN
0FUYXFW8F6,Aerial Treatment To Combat Deadly Mosquito-Borne Disease In Oakland County Planned For Sept. 16,"OAKLAND COUNTY, Mich. (CBS DETROIT) вЂ“ In an effort to prevent spread of Eastern Equine Encephalitis (EEE), the Michigan Department of Health and Human Services has announced plans to conduct aerial mosquito control treatment in certain high-risk areas of Michigan.
Treatment is scheduled to occur starting the evening of Wednesday, Sept. 16. However, treatment can only take place under certain weather conditions, so the schedule may need to change.
EEE is one of the most dangerous mosquito-borne diseases in the United States, with a 33 percent fatality rate in people who become ill. People can be infected with EEE from one bite of a mosquito carrying the virus. Persons younger than age 15 and over age 50 are at greatest risk of severe disease following infection. More than 25 percent of the nationвЂ™s EEE cases last year were diagnosed in Michigan.
Signs of EEE infection include the sudden onset of fever, chills, body and joint aches which can progress to a severe encephalitis, resulting in headache, disorientation, tremors, seizures and paralysis. Anyone who thinks they may be experiencing these symptoms should contact a medical provider. Permanent brain damage, coma and death may also occur in some cases.
Aerial treatment is conducted by specialized aircraft, beginning in the early evening and continuing up until the following dawn. State-certified mosquito control professionals will apply an approved pesticide as an ultra-low volume (ULV) spray. ULV sprayers dispense very fine aerosol droplets that stay suspended in the air and kill adult mosquitoes on contact. This is a method many other states have also used to combat EEE. Aerial treatment is provided by Clarke from St. Charles, Ill., which provides mosquito control to protect public health. Clarke pioneers, develops and delivers environmentally responsible products and services to help prevent vector-borne disease, control nuisance and create healthy water bodies.
Treatment is scheduled for the 10 impacted counties: Barry, Clare, Ionia, Isabella, Jackson, Kent, Mecosta, Montcalm, Newaygo and Oakland. Additional areas may be selected for treatment if new human or animal cases occur outside of the currently identified zones.
Residents are encouraged to visitВ Michigan.gov/EEEВ for up-to-date information.
В© 2020 CBS Broadcasting Inc. All Rights Reserved. This material may not be published, broadcast, rewritten, or redistributed.

Related",https://detroit.cbslocal.com/2020/09/14/aerial-treatment-to-combat-deadly-mosquito-borne-disease-in-oakland-county-planned-for-sept-16/,#,,16/09/2020 09:25,2020-09-14 13:29:00+00:00,de27fa2ff4a5,detroit.cbslocal.com,,1600097340,EN
GAVBDPEXV3,Michigan reports 10 Eastern Equine Encephalitis cases in horses in 3 weeks,"Michigan reports 10 Eastern Equine Encephalitis cases in horses in 3 weeks 
By News. 
Desk @infectiousdiseasenews 
The Michigan Department of Agriculture and Rural Development ( MDARD ) has reported 10 Eastern Equine Encephalitis ( EEE ) cases in horses from four counties -- Montcalm, Clare, Newaygo and Kent counties since the first case was reported in Clare County on Aug. 11. 
Image by Clker-Free-Vector-Images from Pixabay 
EEE is a zoonotic, viral disease, transmitted by mosquitoes to both animals and people. EEE is one of the most dangerous mosquito-borne diseases in the U.S., and the virus is typically seen in late summer to early fall each year in Michigan. 
While horses are highly affected by the disease, people can also be infected with EEE from the bite of a mosquito carrying the virus. In humans, signs of EEE include the sudden onset of fever, chills, and body and joint aches. EEE infection can develop into severe encephalitis, resulting in headache, disorientation, tremors, seizures, and paralysis. Permanent brain damage, coma, and death may also occur in some cases. 
In 2019, Michigan reported 10 human EEE cases, with six cases being fatal. 
MDARD says to protect your horses and other domestic animals ( such as dogs, sheep, and goats ), measures could include the following: 

Talking to a veterinarian about vaccinating horses against EEE. 
Placing livestock in a barn under fans ( as mosquitos are not strong flyers ) during peak mosquito activity from dusk to dawn. 
Using an insect repellant on an animal that is approved for the species. 
Eliminating standing water on the property -- i.e., fill in puddles, repair eaves, and change the water in buckets and bowls at least once a day. 
Contacting a veterinarian if an animal shows signs of the illness: fever and stumbling, which can progress to being down and struggling to stand. 

To protect yourself and your family, here's what you should do now: 

Apply insect repellents that contain the active ingredient DEET, or other U.S. Environmental Protection Agency-approved products, to exposed skin or clothing and always follow the manufacturer's directions for use. 
Wear long-sleeved shirts and long pants when outdoors. Apply insect repellent to clothing to help prevent bites. 
Maintain window and door screening to help keep mosquitoes outside. 
Empty water from mosquito breeding sites around the home, such as buckets, unused children's pools, old tires, or similar sites where mosquitoes may lay eggs. 
Use nets and/or fans over outdoor eating areas. 

Related: 
VIDEO",http://outbreaknewstoday.com/michigan-reports-10-eastern-equine-encephalitis-cases-in-horses-in-3-weeks-32745/,#,,20/09/2020 01:03,2020-09-03 05:00:00+00:00,de27fa2ff4a5,outbreaknewstoday.com,,1599116400,EN
LAG685BX43,"National Round-Up: Four infected with a rare tick-borne virus, SSI warns","National Round-Up: Four infected with a rare tick-borne virus, SSI warns 
Four people in Denmark have been infected with TBE ( Tick Borne Encephalitis ) over the summer, according to Statens Serum Institut. 
The area of Denmark most commonly associated with TBE is Bornholm, but there have been no cases stemming from the island so far this summer. 

Instead, the institute believe three were infected in Tisvilde Hegn in North Zealand and one in Falster -- clear signs the virus is spreading across Denmark. 
Vaccine available 
The infected people are aged 40 to 76 years and all have been hospitalised. 
Some patients can suffer permanent mental or neurological damage, according to SSI. 
Accordingly the institution encourages vaccination against the disease for those who regularly move away from paths through the woods, such as forest workers, hunters, orienteering runners, and mushroom and berry pickers. 

Foreign food suspected as cause of outbreaks 
A total of 48 people in Denmark have become sick as a result of imported foods, suspects the Statens Serum Institut. It believes that separate outbreaks of salmonella and hepatitis A virus are the result of holiday-makers returning with food carrying the diseases. The contagious disease hepatitis A tends to cause yellowish skin and hospitalise 80 percent of those who get it. SSI encourages anyone with foreign food to follow the Danish Veterinary and Food Administration's advice on good kitchen hygiene. 
Thieves targeting GPS equipment used by farm machinery 
In August alone, GPS equipment from a total of 23 tractors was stolen, according to the police. The authorities believe the criminals are selling the equipment on the black market. According to the police, the equipment is worth several million kroner. 
Salling Group to launch delivery service 
The supermarket conglomerate Salling Group, the owner of Netto, FГёtex and Bilka, is launching an online platform where over 10,000 grocery items can be delivered to people's homes, reports BГёrsen. Initially vegetables, fish and meat will be available for door-to-door delivery within Greater Copenhagen, expanding to large parts of the country in the long run. As part of the plan, the group expects to hire up to 400 new employees. Its rival Coop already offers an online supermarket service. 
Four Danish men have been arrested in connection with illegal film distribution, according to the Public Prosecutor for Special Economic and International Crime ( SГёik ). The major international case involves authorities from 19 countries, including Denmark. The criminal organisation has allegedly obtained access to movies and series before their release dates. SГёik expects it has cost the industry more than 60 million kroner. The four have been charged with particularly serious copyright infringement.",http://cphpost.dk/?p=117779,"North Zealand, ",,29/10/2020 12:06,2020-08-27 05:00:00+00:00,de27fa2ff4a5,cphpost.dk,,1598511600,EN
L4Q895XAUI,Mosquito with Saint Louis Encephalitis found in Corpus Christi,"Mosquito with Saint Louis Encephalitis found in Corpus Christi. 
Alexandria Rodriguez 
Corpus Christi Caller Times. 
Published 9:13 AM EDT Aug 18, 2020Health officials have detected Saint Louis Encephalitis virus in a mosquito pool collected in Corpus Christi. The pool was collected from the 400 block of Bartlett Street, near Old Robstown Road, according to a news release. Saint Louis Encephalitis, or SLE, is a viral disease spread to people by the bite of an infected mosquito. Those who become ill after contracting SLE may have fever, headache, nausea, vomiting and may feel tired, the release states. `` Severe neuro-invasive disease ( often involving encephalitis, an inflammation of the brain ) occurs more commonly in older adults, '' the release reads. Most people who contract SLE have no apparent illness. The last positive case of SLE in a mosquito in Nueces County was reported in 2016. City Vector Control deploys traps throughout the city to monitor mosquito populations. Those mosquitoes are later sent to the Department of State Health Services laboratory in Austin to be analyzed for vector borne diseases, the release states. `` At this time, only one positive mosquito pool has been identified, '' the release reads. `` No cases have been reported in humans at this time. `` Vector Services has implemented its Mosquito Management Response Plan. These are the measures included in the plan: Spray within a 1/2-mile radius around the area of the detection for three consecutive nights beginning Tuesday evening, weather permitting. Police will Direct Patrol Officers and Neighborhood Services personnel to locate any standing water in the affected neighborhood including examining abandoned properties. Vector Services will continue to monitor and conduct surveillance of mosquito traps in the immediate area for signs of the Culex species of mosquito. How to prevent SLE infection. 
Deet - use insect repellent with Deet. 
Dress - dress in long sleeves and pants when outside Dawn, Daytime and Dusk - Avoid being outside during these times to prevent bites. These times are when mosquitoes are most active. 
Drain - Drain standing water. Mosquitoes breed in standing water. Doctor - Consult a doctor if you feel sick after a mosquito bite. Alexandria Rodriguez covers breaking news and crime in South Texas. Support local news by checking out our subscription options and special offers at Caller.com / subscribe",https://www.caller.com/story/news/local/2020/08/18/mosquito-saint-louis-encephalitis-found-corpus-christi-august-2020/3389669001/,South Texas,,16/09/2020 09:25,2020-08-18 05:00:00+00:00,de27fa2ff4a5,www.caller.com,,1597734000,EN
